{"buckets":[{"bucket":"synonym","language":"zh","mrrAt10":{"cutoff":10,"value":1},"negativeQueryCount":0,"queryCount":3,"recallAt10":{"macro":1,"micro":1},"recallAt5":{"macro":1,"micro":1},"relevantQueryCount":3},{"bucket":"synonym","language":"en","mrrAt10":{"cutoff":10,"value":1},"negativeQueryCount":0,"queryCount":3,"recallAt10":{"macro":1,"micro":1},"recallAt5":{"macro":1,"micro":1},"relevantQueryCount":3},{"bucket":"pronoun","language":"zh","mrrAt10":{"cutoff":10,"value":1},"negativeQueryCount":0,"queryCount":3,"recallAt10":{"macro":1,"micro":1},"recallAt5":{"macro":1,"micro":1},"relevantQueryCount":3},{"bucket":"pronoun","language":"en","mrrAt10":{"cutoff":10,"value":1},"negativeQueryCount":0,"queryCount":3,"recallAt10":{"macro":1,"micro":1},"recallAt5":{"macro":1,"micro":1},"relevantQueryCount":3},{"bucket":"multi_topic","language":"zh","mrrAt10":{"cutoff":10,"value":1},"negativeQueryCount":0,"queryCount":3,"recallAt10":{"macro":1,"micro":1},"recallAt5":{"macro":1,"micro":1},"relevantQueryCount":3},{"bucket":"multi_topic","language":"en","mrrAt10":{"cutoff":10,"value":0.833333},"negativeQueryCount":0,"queryCount":3,"recallAt10":{"macro":1,"micro":1},"recallAt5":{"macro":1,"micro":1},"relevantQueryCount":3},{"bucket":"current_head","language":"zh","mrrAt10":{"cutoff":10,"value":0.75},"negativeQueryCount":1,"queryCount":4,"recallAt10":{"macro":1,"micro":1},"recallAt5":{"macro":1,"micro":1},"relevantQueryCount":3},{"bucket":"current_head","language":"en","mrrAt10":{"cutoff":10,"value":1},"negativeQueryCount":1,"queryCount":4,"recallAt10":{"macro":1,"micro":1},"recallAt5":{"macro":1,"micro":1},"relevantQueryCount":3},{"bucket":"temporal","language":"zh","mrrAt10":{"cutoff":10,"value":0.4},"negativeQueryCount":0,"queryCount":3,"recallAt10":{"macro":0.666667,"micro":0.666667},"recallAt5":{"macro":0.666667,"micro":0.666667},"relevantQueryCount":3},{"bucket":"temporal","language":"en","mrrAt10":{"cutoff":10,"value":0.833333},"negativeQueryCount":1,"queryCount":4,"recallAt10":{"macro":1,"micro":1},"recallAt5":{"macro":1,"micro":1},"relevantQueryCount":3},{"bucket":"cross_session","language":"zh","mrrAt10":{"cutoff":10,"value":1},"negativeQueryCount":2,"queryCount":5,"recallAt10":{"macro":1,"micro":1},"recallAt5":{"macro":1,"micro":1},"relevantQueryCount":3},{"bucket":"cross_session","language":"en","mrrAt10":{"cutoff":10,"value":1},"negativeQueryCount":2,"queryCount":5,"recallAt10":{"macro":1,"micro":1},"recallAt5":{"macro":1,"micro":1},"relevantQueryCount":3},{"bucket":"exact_id","language":"zh","mrrAt10":{"cutoff":10,"value":0.097222},"negativeQueryCount":0,"queryCount":3,"recallAt10":{"macro":0.666667,"micro":0.666667},"recallAt5":{"macro":0,"micro":0},"relevantQueryCount":3},{"bucket":"exact_id","language":"en","mrrAt10":{"cutoff":10,"value":0.361111},"negativeQueryCount":0,"queryCount":3,"recallAt10":{"macro":1,"micro":1},"recallAt5":{"macro":1,"micro":1},"relevantQueryCount":3}],"cases":[{"bucket":"synonym","channel":"profile","corpusId":"shared-retrieval-corpus-v1","firstRelevantRank":1,"forbiddenHits":[],"forbiddenIds":[],"id":"q-synonym-zh-01","language":"zh","recallAt10":1,"recallAt5":1,"reciprocalRank":1,"relevantIds":["mem-synonym-zh-cinema"],"returnedIds":["mem-synonym-zh-cinema","mem-synonym-en-cinema"],"split":"baseline"},{"bucket":"synonym","channel":"profile","corpusId":"shared-retrieval-corpus-v1","firstRelevantRank":1,"forbiddenHits":[],"forbiddenIds":[],"id":"q-synonym-zh-02","language":"zh","recallAt10":1,"recallAt5":1,"reciprocalRank":1,"relevantIds":["mem-synonym-zh-cinema"],"returnedIds":["mem-synonym-zh-cinema"],"split":"baseline"},{"bucket":"synonym","channel":"profile","corpusId":"shared-retrieval-corpus-v1","firstRelevantRank":1,"forbiddenHits":[],"forbiddenIds":[],"id":"q-synonym-zh-03","language":"zh","recallAt10":1,"recallAt5":1,"reciprocalRank":1,"relevantIds":["mem-synonym-zh-cinema"],"returnedIds":["mem-synonym-zh-cinema"],"split":"holdout"},{"bucket":"synonym","channel":"profile","corpusId":"shared-retrieval-corpus-v1","firstRelevantRank":1,"forbiddenHits":[],"forbiddenIds":[],"id":"q-synonym-en-01","language":"en","recallAt10":1,"recallAt5":1,"reciprocalRank":1,"relevantIds":["mem-synonym-en-cinema"],"returnedIds":["mem-synonym-en-cinema"],"split":"baseline"},{"bucket":"synonym","channel":"profile","corpusId":"shared-retrieval-corpus-v1","firstRelevantRank":1,"forbiddenHits":[],"forbiddenIds":[],"id":"q-synonym-en-02","language":"en","recallAt10":1,"recallAt5":1,"reciprocalRank":1,"relevantIds":["mem-synonym-en-cinema"],"returnedIds":["mem-synonym-en-cinema","mem-synonym-zh-cinema"],"split":"baseline"},{"bucket":"synonym","channel":"profile","corpusId":"shared-retrieval-corpus-v1","firstRelevantRank":1,"forbiddenHits":[],"forbiddenIds":[],"id":"q-synonym-en-03","language":"en","recallAt10":1,"recallAt5":1,"reciprocalRank":1,"relevantIds":["mem-synonym-en-cinema"],"returnedIds":["mem-synonym-en-cinema"],"split":"holdout"},{"bucket":"pronoun","channel":"normal","corpusId":"shared-retrieval-corpus-v1","firstRelevantRank":1,"forbiddenHits":[],"forbiddenIds":[],"id":"q-pronoun-zh-01","language":"zh","recallAt10":1,"recallAt5":1,"reciprocalRank":1,"relevantIds":["mem-pronoun-zh-wutong"],"returnedIds":["mem-pronoun-zh-wutong","mem-exact-en-marigold-9c2d","mem-cross-zh-bluewhale","mem-multi-zh-launch","mem-multi-en-launch","mem-noise-en-northstar-budget"],"split":"baseline"},{"bucket":"pronoun","channel":"normal","corpusId":"shared-retrieval-corpus-v1","firstRelevantRank":1,"forbiddenHits":[],"forbiddenIds":[],"id":"q-pronoun-zh-02","language":"zh","recallAt10":1,"recallAt5":1,"reciprocalRank":1,"relevantIds":["mem-pronoun-zh-wutong"],"returnedIds":["mem-pronoun-zh-wutong","mem-pronoun-en-atlas","mem-noise-zh-northstar-budget","mem-multi-zh-editor","mem-noise-en-northstar-budget","mem-multi-en-editor","mem-exact-en-marigold-9c2d"],"split":"baseline"},{"bucket":"pronoun","channel":"normal","corpusId":"shared-retrieval-corpus-v1","firstRelevantRank":1,"forbiddenHits":[],"forbiddenIds":[],"id":"q-pronoun-zh-03","language":"zh","recallAt10":1,"recallAt5":1,"reciprocalRank":1,"relevantIds":["mem-pronoun-zh-wutong"],"returnedIds":["mem-pronoun-zh-wutong","mem-cross-en-purple-label","mem-exact-en-marigold-9c2d","mem-pronoun-en-atlas","mem-noise-zh-northstar-budget","mem-noise-en-northstar-budget","mem-current-en-codename-new","mem-multi-zh-editor","mem-multi-zh-launch","mem-temporal-en-meeting-current"],"split":"holdout"},{"bucket":"pronoun","channel":"normal","corpusId":"shared-retrieval-corpus-v1","firstRelevantRank":1,"forbiddenHits":[],"forbiddenIds":[],"id":"q-pronoun-en-01","language":"en","recallAt10":1,"recallAt5":1,"reciprocalRank":1,"relevantIds":["mem-pronoun-en-atlas"],"returnedIds":["mem-pronoun-en-atlas","mem-multi-en-launch","mem-cross-en-purple-label","mem-exact-en-marigold-9c2d","mem-current-en-codename-new","mem-multi-en-editor","mem-temporal-en-meeting-current","mem-noise-en-northstar-budget","mem-pronoun-zh-wutong","mem-exact-zh-orchid-7f3a"],"split":"baseline"},{"bucket":"pronoun","channel":"normal","corpusId":"shared-retrieval-corpus-v1","firstRelevantRank":1,"forbiddenHits":[],"forbiddenIds":[],"id":"q-pronoun-en-02","language":"en","recallAt10":1,"recallAt5":1,"reciprocalRank":1,"relevantIds":["mem-pronoun-en-atlas"],"returnedIds":["mem-pronoun-en-atlas","mem-current-en-codename-new","mem-cross-en-purple-label","mem-exact-en-marigold-9c2d","mem-pronoun-zh-wutong","mem-multi-en-editor","mem-temporal-en-meeting-current","mem-multi-en-launch","mem-noise-en-northstar-budget","mem-temporal-zh-meeting-current"],"split":"baseline"},{"bucket":"pronoun","channel":"normal","corpusId":"shared-retrieval-corpus-v1","firstRelevantRank":1,"forbiddenHits":[],"forbiddenIds":[],"id":"q-pronoun-en-03","language":"en","recallAt10":1,"recallAt5":1,"reciprocalRank":1,"relevantIds":["mem-pronoun-en-atlas"],"returnedIds":["mem-pronoun-en-atlas","mem-current-en-codename-new","mem-multi-en-editor","mem-temporal-en-meeting-current","mem-cross-en-purple-label","mem-multi-en-launch","mem-noise-en-northstar-budget","mem-exact-en-marigold-9c2d","mem-pronoun-zh-wutong","mem-multi-zh-editor"],"split":"holdout"},{"bucket":"multi_topic","channel":"normal","corpusId":"shared-retrieval-corpus-v1","firstRelevantRank":1,"forbiddenHits":[],"forbiddenIds":[],"id":"q-multi-topic-zh-01","language":"zh","recallAt10":1,"recallAt5":1,"reciprocalRank":1,"relevantIds":["mem-multi-zh-launch","mem-multi-zh-editor"],"returnedIds":["mem-multi-zh-editor","mem-noise-zh-northstar-budget","mem-multi-zh-launch","mem-pronoun-zh-wutong","mem-exact-zh-orchid-7f3a","mem-temporal-en-meeting-current"],"split":"baseline"},{"bucket":"multi_topic","channel":"normal","corpusId":"shared-retrieval-corpus-v1","firstRelevantRank":1,"forbiddenHits":[],"forbiddenIds":[],"id":"q-multi-topic-zh-02","language":"zh","recallAt10":1,"recallAt5":1,"reciprocalRank":1,"relevantIds":["mem-multi-zh-launch","mem-multi-zh-editor"],"returnedIds":["mem-multi-zh-editor","mem-multi-zh-launch","mem-noise-en-northstar-budget","mem-multi-en-launch","mem-cross-en-purple-label","mem-pronoun-en-atlas","mem-noise-zh-northstar-budget","mem-temporal-en-meeting-current","mem-current-en-codename-new","mem-exact-zh-orchid-7f3a"],"split":"baseline"},{"bucket":"multi_topic","channel":"normal","corpusId":"shared-retrieval-corpus-v1","firstRelevantRank":1,"forbiddenHits":[],"forbiddenIds":[],"id":"q-multi-topic-zh-03","language":"zh","recallAt10":1,"recallAt5":1,"reciprocalRank":1,"relevantIds":["mem-multi-zh-launch","mem-multi-zh-editor"],"returnedIds":["mem-multi-zh-editor","mem-multi-zh-launch","mem-noise-zh-northstar-budget"],"split":"holdout"},{"bucket":"multi_topic","channel":"normal","corpusId":"shared-retrieval-corpus-v1","firstRelevantRank":1,"forbiddenHits":[],"forbiddenIds":[],"id":"q-multi-topic-en-01","language":"en","recallAt10":1,"recallAt5":1,"reciprocalRank":1,"relevantIds":["mem-multi-en-launch","mem-multi-en-editor"],"returnedIds":["mem-multi-en-editor